{
  "id": "uther",
  "name": "Uther Pendragon",
  "rank": "principal",
  "role": "King of Britain",
  "house": "Pendragon",
  "branch": "chronicle",
  "one_line": "Arthur's father, who wanted another man's wife badly enough to take a magician's help — and started everything.",
  "aka": [
    {
      "form": "Uther Pendragon",
      "tradition": "chronicle"
    },
    {
      "form": "Uterpendragon",
      "tradition": "french"
    }
  ],
  "traditions": [
    "chronicle",
    "french",
    "english"
  ],
  "first_text": "Geoffrey of Monmouth",
  "dossier": "Uther's whole function is the begetting, and both the chronicle and the romance tell it the same way.\n\nHe summons the Duke of Cornwall and his wife Igraine to court, conceives an overwhelming desire for her, and is refused. War follows. While the duke is besieged in one castle and Igraine shut in another at Tintagel, Merlin changes Uther's shape to the duke's and lets him in. The duke is killed that same night, some hours before Uther reaches Igraine's bed — a detail both traditions are careful to include, because it makes the subsequent marriage legitimate and the child's conception not quite adulterous, on a technicality.\n\nMerlin's fee is the child.\n\nMalory's Uther dies early and badly, and the realm is left in confusion for years because nobody knows there is an heir. Everything that follows — the stone, the sword, the boy nobody has heard of — exists because of how this was arranged.\n\nWhat Uther leaves behind is a vacuum, and Malory is precise about how bad it is. The king dies without publicly acknowledging an heir — the only people who know the child exists are Merlin, Ector, and a handful of lords sworn to silence — and the realm stands *in great jeopardy long while, for every lord that was mighty of men made him strong, and many weened to have been king.* Years pass. There is no government.\n\nIt is Merlin who ends it, by proposing the stone and the sword, which means that the mechanism that makes Arthur king was designed by the man who arranged his conception and holds the contract on his life. The test in the churchyard looks like an act of God and is in fact a piece of stage management by an interested party. Malory does not point this out. He simply puts the two facts twenty pages apart and lets them sit there.",
  "kin": [
    {
      "id": "igraine",
      "relation": "wife",
      "label": "Igraine"
    },
    {
      "id": "arthur",
      "relation": "son",
      "label": "Arthur"
    }
  ],
  "arc": [
    {
      "episode": "uther-and-igraine",
      "note": "the deception, and the price Merlin sets"
    }
  ],
  "cuts": [
    "source-of-rule"
  ],
  "cost": "The kingdom's founding act is a deception arranged by a magician who takes the resulting child as payment. Nothing in the story is legitimate all the way down."
}
